{
  "schema_version": "1.0",
  "library": {
    "name": "Design Taste Library",
    "owner": "arubalcaba",
    "updated": "2026-08-16"
  },
  "style_families": [
    {
      "id": "print-tech-paper",
      "label": "Print-Tech Paper",
      "definition": "Editorial print DNA applied to software — paper-toned grounds, engraved or halftone imagery, small tracked-out labels, one restrained accent. Feels printed rather than rendered.",
      "accent": "#B4523A",
      "deploy_for": "Tools and methods that should feel considered and human — where the buyer distrusts marketing polish and is persuaded by evident craft.",
      "risk": "Render the hero entirely as engraving or halftone and let a dashed route or coordinate marks carry the information architecture instead of headings.",
      "image_style": "[SUBJECT] rendered as a fine 19th-century steel engraving, dense crosshatch and stipple, greyscale line work with no solid fills, at most one pale wash, isolated on a warm paper ground with generous empty space for typography"
    },
    {
      "id": "brutalist-duotone",
      "label": "Brutalist Duotone",
      "definition": "Exactly two colors that swap ground/ink roles between sections. Oversized cropped display type, zero corner radius, stark high-contrast photography. Loud by structure, not by decoration.",
      "accent": "#EF3124",
      "deploy_for": "Agencies, portfolios and launches that need to be remembered more than they need to be liked.",
      "risk": "Set the wordmark at a scale the viewport has to crop, and let one image overlap it.",
      "image_style": "[SUBJECT] photographed in stark high-contrast monochrome, subject in black against a blown-out or black ground, hard rectangular crop at zero radius, no midtone softness"
    },
    {
      "id": "lush-display-commerce",
      "label": "Lush Display Commerce",
      "definition": "Deep saturated grounds alternating with white, polychrome accents, high-contrast display caps with imagery set inline as glyphs. Editorial energy applied to retail.",
      "accent": "#F0682A",
      "deploy_for": "Retail and DTC brands with physical product, where warmth and abundance sell better than restraint.",
      "risk": "Cut a photograph into the headline itself so it sits inline where a word would be.",
      "image_style": "[SUBJECT] silhouetted cleanly from its background with no shadow, centred on a flat circle of saturated colour, product-catalogue clarity, true-to-life colour"
    },
    {
      "id": "glitched-antiquity",
      "label": "Glitched Antiquity",
      "definition": "Greco-Roman or Renaissance figurative art degraded by digital artifacts — RGB channel separation, datamosh, corrupted text — on a near-black ground with iridescent accents. Reverence and corruption in the same frame.",
      "accent": "#7FD4E8",
      "deploy_for": "Technical products that want borrowed gravity — finance, infrastructure, AI — where classical authority offsets how new the thing is.",
      "risk": "Corrupt the navigation itself rather than only the artwork, and let it resolve on hover.",
      "image_style": "[SUBJECT] rendered as classical artwork in warm sepia and bone, degraded with heavy RGB channel separation streaking off the trailing edge into prismatic fringes, scattered dither artifacts, on a near-black ground"
    },
    {
      "id": "gradient-glass",
      "label": "Gradient Glass",
      "definition": "Vivid multi-hue gradient grounds with translucent 3D geometry as the dominant image. Frosted backdrop-blur UI surfaces, centered heavy sans type, high gloss throughout. Depth by material, not by shadow.",
      "accent": "#9D4DF7",
      "deploy_for": "Launches with one idea to sell and no product to show yet — crypto, AI, pre-revenue.",
      "risk": "Spend the entire viewport on a single rendered object and put nothing below the fold.",
      "image_style": "[SUBJECT] in frosted translucent glass, sharp specular highlights on every leading edge, refracting a vivid multi-hue gradient, studio lit with no visible source, cropped by the frame, seamless gradient ground with no floor plane"
    },
    {
      "id": "painterly-nocturne",
      "label": "Painterly Nocturne",
      "definition": "Near-black grounds with hand-painted atmospheric illustration — clouds, weather, sky — as the environment rather than a placed image. Elegant high-contrast serif, achromatic palette, ambient motion held to the periphery.",
      "accent": "#FCF8F2",
      "deploy_for": "Calm, considered products — AI assistants, wellness, writing tools — that need to read unhurried rather than urgent.",
      "risk": "Hold every moving element to the edges and leave the centre of the composition perfectly still.",
      "image_style": "[SUBJECT] as hand-painted illustration with visible brushwork and feathered edges, warm cream highlights against cool slate shadow on near-black, strictly achromatic, composed with the centre left clear for typography"
    }
  ],
  "trait_vocabulary": "vocabulary.json",
  "entries": [
    {
      "id": "spade",
      "title": "SPADE",
      "formula": "print-tech x data",
      "description": "Transaction-enrichment platform for finance. Technical-survey drawing standing in for messy data made legible.",
      "style_family": "print-tech-paper",
      "kind": "shipped",
      "platform": "web",
      "source": {
        "url": "https://spade.com/",
        "screenshot": "images/spade-hero.png",
        "captured": "2026-08-07",
        "attribution": "Spade",
        "page_type": "landing"
      },
      "traits": [
        "pastel tinted ground",
        "topographic line art",
        "mono utility labels",
        "heavy sans headline",
        "floating ui card",
        "scroll linked motion"
      ],
      "tokens": {
        "extraction": "measured",
        "palette": [
          {
            "role": "ground",
            "hex": "#F4FAED",
            "name": "sage-1"
          },
          {
            "role": "ink",
            "hex": "#090F05",
            "name": "black"
          },
          {
            "role": "surface",
            "hex": "#FFFFFF",
            "name": "white"
          },
          {
            "role": "muted",
            "hex": "#4A5B38",
            "name": "sage-5"
          },
          {
            "role": "border",
            "hex": "#D8E5CA",
            "name": "sage-3"
          },
          {
            "role": "accent",
            "hex": "#C9753D",
            "name": "clay"
          },
          {
            "role": "support",
            "hex": "#D0C4A5",
            "name": "stone"
          },
          {
            "role": "support",
            "hex": "#331B09",
            "name": "earth"
          }
        ],
        "typography": {
          "display": "naNSuperX (NaN Super X), semibold — large, centered",
          "body": "polar — fluid clamp() sizing, 13px mobile to 14px desktop base, 1.25/1.333 modular scale",
          "mono": "polarMono — transaction IDs, coordinates, amounts"
        },
        "layout": "Centered single column at --container-width 82.5rem (86.25rem at large); padding 2.5rem mobile / 6rem desktop; hero animation mid-page with product UI fragments over its edges",
        "texture": "Fine contour line work rendered live in Rive; everything else flat, no grain",
        "motion": "Measured from the shipped site, not observed rendering. Six Rive runtime animations, incl. homepage-masthead-animation-2.riv (266 KB, 1 artboard / 3 state machines / 3 timelines) driving the hero contour illustration, and homepage-scroller-animation-2.riv for a scroll-driven section. Framer Motion useScroll/useTransform present in two shipped chunks. CSS adds a 25s linear infinite marquee, a Swiper carousel, and state transitions at 250ms and 500ms on ease-in-out / ease-out / cubic-bezier(.4,0,.2,1). Masthead loop mode undetermined — Rive names are all defaults and loop is a binary property not read.",
        "corner_radius": "8px on cards, 6px on buttons",
        "density": "balanced"
      },
      "brief": "A data-infrastructure landing page that earns trust through technical drawing rather than gloss. Ground the entire page in a pale sage #E7EDE4 — the single most defining choice, and the reason it reads as a survey document instead of another white SaaS page. Headline is a heavy geometric sans set large and centered in near-black, weight doing all the emphasis work: no color, no serif, no italic. Center the hero on a fine topographic contour-line drawing of an abstract mass, pure hairline strokes with no fill or shading. Composite three or four real product-UI fragments over its edges at slight offsets — a transaction row, an ID block, a coordinate pair — each a white 8px-radius card with a barely-there shadow. All metadata inside those fragments is small monospace: transaction IDs, lat/long, dollar amounts. Body copy is centered, muted grey, one short paragraph. Nav is text-only with a single dark button. No gradients, no glass, no illustration color.",
      "image_recipe": {
        "target_platform": null,
        "target_model": null,
        "resolution": "2K",
        "aspect_ratio": "1:1",
        "subject_default": "an abstract eroded geological mass",
        "template": "[SUBJECT: {{subject}}] rendered as a fine topographic contour-line drawing, evenly spaced hairline contours describing elevation across the form, pure line art with absolutely no fill and no shading, single dark ink #16181A on a transparent ground, technical survey precision as if plotted by machine, isolated and centered with generous empty margin on all sides.",
        "negatives": [
          "no fill",
          "no shading",
          "no color",
          "no perspective grid",
          "no drop shadow"
        ]
      },
      "meta": {
        "added": "2026-08-07",
        "steal_this": "",